"I think it's important that it's done in a respectful and thoughtful way instead of becoming the next big capitalist machine, given the history of the plant I think that would be pretty upsetting.  And  I hope that legalizing cannabis will lead to people who were arrested because of the war on drugs being released from prison??","1","0.14"
"I think it's long overdue ","1","0.14"
"I think it's the most important next step that needs to happen for a multitude of conditions and struggles. It's also vital that it be de-scheduled so accurate research can happen and everything we know is not based on anecdotal information.","1","0.14"
"I think it's wonderful. I hope that it enables this amazing therapeutic plant to reach more number of people. I hope that it can help to dispel the false information that our government has perpetuated surrounding cannabis. I hope that it encourages evidence based decisions on the subject.","1","0.14"
"I think it is a good idea, and it should replace tobacco.","1","0.14"
"I think it is a good thing, it is a very helpful medicine in many different ways for so many people. ","1","0.14"
"I think it is an amazing thing. To be able to have something that let's me get out of my house and to be able to function without being on meds.","1","0.14"
"I think it is criminal that there are still states under prohibition.  I have relatives who suffer seizures.  They are contemplating moving to a legal state.  Every American citizen should have access.","1","0.14"
"I think it is great and hope it continues to be more regulated, hopefully stay same prices or get cheaper, and stigma decreases","1","0.14"
"I think it is great and that it is something the federal government needs to do as well.","1","0.14"
"i think it is great.. alcohol is far more damaging and socially accepted.. crazy","1","0.14"
"I think it is important that it is legalized. Too many people have been arrested over marijuana.","1","0.14"
"I think it is overall a good thing, and very exciting, however issues around social equity, big business, and environmental impact in particular are disconcerting. ","1","0.14"
"I think it should be just for medical","1","0.14"
"I think it should be legal","1","0.14"
"I think it should be legal across the board federally ","1","0.14"
"I think it should be legal all across the board ","1","0.14"
"I think it should be legal and used for all kinds of funding.","1","0.14"
"I think it should be legal everywhere ","1","0.14"
"I think it should be legal everywhere.","1","0.14"
"I think it should be legal federally.","1","0.14"
"I think it should be legal worldwide","1","0.14"
"I think it should be legalized and treated like tobacco.","1","0.14"
"I think it should be legalized so the products can be regulated. Recreational users pretending to be medical patients have shifted the products available towards only high THC products and those aren't always the best products for medical patients. I rarely see products with known cannabinoids and terpenes that have been shown to reduce inflammation and nerve pain. I don't mind if they also use cannabis, but I would like to have more medicinal strains available and more consistency in the products. The wait times and process are also ridiculously long because of the additional people. If we are going to say it is a medicine it needs to be treated as one, but we can also acknowledge that some strains are more for recreational use and others are for medicinal use.   ","1","0.14"
"I think it should be recreationally legal and available to those over the age of 18. And medically available with doctor advisement to those under 18. I firmly believe in cannabis’ medicinal benefits. ","1","0.14"
"I think it should be recreationally legal on a federal level and taxed to help the country’s debt. It needs to be cheaper and accessible for ALL especially in an opioid epidemic ","1","0.14"
"I think it was a long time coming. The stigma surrounding cannabis is ridiculous, and the medical benefits have been recognized across the world long before the arbitrary laws were put in place. ","1","0.14"
"I think it will solve the economic crisis we seem to be falling back into. ","1","0.14"
"I think it would be a great idea ","1","0.14"
"I think it’s amazing! I feel like it’s a drug that has many more positives than negatives. ","1","0.14"
"I think it’s awesome! It’s about time it has so many health benefits everyone could benefit by using it. ","1","0.14"
"I think it’s fantastic it allows me to not put pulls in my body any more","1","0.14"
"I think it’s great","1","0.14"
"I think it’s great ","1","0.14"
"I think it’s ridiculous that it is not Federally legalized yet.  Alcohol is worse ","1","0.14"
"I think its great for people who have medical needs glad it got legalize.","1","0.14"
"I think most adults are of sound enough mind to make an informed decision for themselves without the misguided information from big pharmaceutical companies and doctors that are totally ignorant to the effectiveness and benefits proven over time from various trustworthy sources. ","1","0.14"
"I think people have the right to try, but I also believe regulation allows safe production of cannabis products. Regulation should help stop the market both legitimate and black; from being saturated, it needs quality control and safe tasting prior to distribution ","1","0.14"
"I think ppl will absue it","1","0.14"
"I think that it is about time!","1","0.14"
"I think that it is crazy that alcohol is legal over cannabis - LEGALIZE LEGALIZE LEGALIZE ","1","0.14"
"I think that it should be monitored and used medically. I am not to excited about it being recreational","1","0.14"
"I think that it will help many people, and harm a few.  However, ultimately, individuals who are helped or harmed must take personal responsibility for their own decisions.  Just as there are people who misuse alcohol, there will be people who misuse pot.  I expect most of the people who misuse pot to fall in to one of two categories:  1. People who already misuse it.  2. People who already misuse other drugs (alcohol and prescriptions included)  If a large number of people get a quality of life improvement, at the expense of indulging people who are already using far more dangerous drugs, I see it as a net benefit.  State resources should be spent on education and rehabilitation, rather than a futile attempt at prohibition.","1","0.14"
"I think that legalization of cannabis is long past due. I see recreational use as almost the same as drinking alcohol. Medically, this should not even be a question. There is no doubt in my mind that medical use cannabis can help with symptoms that would otherwise require opiates.","1","0.14"
"I think the U.S. Gov needs to amend weed and make it legal for everyone to use in every state. I should be able to travel with my medicine & use my medicine no matter which state i visit.","1","0.14"
"I think the war on drugs has been an abysmal failure and needs to end.  That being said strong protections need to be put in place for medical cannabis patients as well as the products they use, and research needs to be increased dramatically.  Policies need to be fact and science-based, personal believes have no place in cannabis policymaking.   ","1","0.14"
"I think there needs to be more uniformity when it comes to laws and regualtions across cities and towns as well as across states. I think testing facilities should be audited by third parties. I think that testing regulations should also be uniform across the US- strict like MA is preferred.","1","0.14"
"I think we're still behind the times. I'm moving to New Jersey next month, where I'll have to see a local doctor for at least one year before I can even get attempt to get registered for medical marijuana use. When I stop smoking, I get sick to the point of vomiting. And now I HAVE to stop smoking, or break the law. It's painful and unnecessary.","1","0.14"
"I think we need to make sure our social equity programs are seen through to the end.","1","0.14"
"I totally agree it should be legal for over 21","1","0.14"
"I was a proponent and still am ","1","0.14"
"I was against cannabis for many years. Long before any dispensary opened near me, my husband tried getting me to consider using it, but I always refused. Having become for educated through research when I first heard a dispensary was opening near me, I decided to give it a try, and it helps my quality of life enormously. Had recreational been legalized first (or rec. dispensaries came out first), I might be more hesitant to try it...but now I'm all for it","1","0.14"
"I wish they would have done it sooner ","1","0.14"
"I would like everyone to know the pros of cannabis use","1","0.14"
"I’m all for it ","1","0.14"
"I’m all for it!! Our laws are very outdated to the research and effects that cannabis has. Only positive vibes!!!","1","0.14"
"I’m for it ","1","0.14"
"I’m for it as long as it is done in the proper places. ","1","0.14"
"I’m in full support of it. If we can legalize alcohol and tobacco, both substances with lots of dangerous side effects, then we can legalize cannabis which has few negative side effects","1","0.14"
"I’m in support of legalization ","1","0.14"
"I’m pretty happy about it and maybe it can reduce stigma","1","0.14"
"I’m so for it the amount of jobs and tax revenue it will bring to the state of Massachusetts is astronomical and important for us to grow as a state ","1","0.14"
"If it is legalized, there needs to be better consumer education regarding safe consumption.  ","1","0.14"
"if we can get it legalized on a federal lever, maybe insurance companies will change their stance and cover medical marijuana just as they do Percocet, Vicodin, etc. I am out of work due to an accident on a job, now I could no longer afford private health care so I am on Mass Health. I have 2 sons and my wife is a student so we survive off my weekly workers comp check. After my surgeries, unless I want to load up on oxycodone, I have to pay out of pocket for medical marijuana, which can be costly, especially on low income.","1","0.14"
"im all for it. mothers should stop being tested for thc if its legal.","1","0.14"
"Im very happy they leaglized medical & recreational  ","1","0.14"
"imperative","1","0.14"
"In favor 100%","1","0.14"
"In my country its still ilegal. We have a law without a reglamentation.","1","0.14"
"Indifferent ","1","0.14"
"Is a must for treating illness","1","0.14"
"It's a positive change twords medicine","1","0.14"
"It's a travesty that we have to have this conversation. It should be federally legal, regulated, standardized nomenclature and people should be able to grow/produce their own products and have access to educational tools to allow them to do that. Big corporations are already doing damage to this industry.","1","0.14"
"It's a wonderful supplement, that needs more research ","1","0.14"
"It's about damn time!","1","0.14"
"It's about damn time! This is the cure. ","1","0.14"
"It's about goddamn time!","1","0.14"
"It's about time","1","0.14"
"it's about time ","1","0.14"
"It's about time!","1","0.14"
"It's about time, but regulatory efforts must be supported and enforced. I see it as akin to alcohol - and in some cases a replacement for alcohol - where limits must be respected and underage access strictly prevented.","1","0.14"
"it's about time.  the stigma needs to go away. we are lucky where we live. when I hear stories of people who are medically compromised and live in a prohibition state and are nervous to get their loved ones cannabis in another state because of the legalities, it makes me crazy.","1","0.14"
"It's about time. Still a long way to go.","1","0.14"
"it's about time...","1","0.14"
"It's almost certainly a positive for society, but either way we'll now have access to enough information to find out for sure. ","1","0.14"
"It's been a long road but it's expanding to possibly cafes!","1","0.14"
"It's been a long slow process...something needs to change and fast.","1","0.14"
"It's been a long time coming","1","0.14"
"It's been a long time coming. Now let's make some real progress!","1","0.14"
"It's been here long bfor man it is a natural organic","1","0.14"
"It's been way too long!  Canada is ahead of the U.S. per usual","1","0.14"
"It's beneficial to people and the government's pocket as well.","1","0.14"
"It's going to be too expensive to buy legally.TAXES!","1","0.14"
"It's good","1","0.14"
"It's great, but everything revolves around money. ","1","0.14"
"It's great,and about time.","1","0.14"
"It's inevitable.","1","0.14"
"It's insane that cannabis is illegal. Prohibition is a terrible policy for almost anything, but especially something that is either benign or beneficial as cannabis is. Legalization needs to happen so that innocent people stop being punished and so that use of a relatively harmless substance stops being a way for private prisons to profit off of what is essentially slave labor.     Not to mention giant pharmaceutical companies pushing meds, opioid epidemic destroying communities and fammilies, alcohol abuse affecting quality of life/public safety, etc. The list goes on forever and I'm sure you've heard it all.     Bottom line, cannabis should never have been outlawed and the fact that it can't even be studied is a travesty. ","1","0.14"
"It's long over due. I need access to something that both allows me to get through my day without having to go to the restroom literally 20 times in an 8 hour workday. It relieves my anxiety in general and has had wonderful benefits on the sleep issues I encounter because of my PTSD. It isn't fair that I should suffer, be forced to take pharmaceuticals that have devastating side effects or made to feel like a criminal for something as harmless as cannabis. ","1","0.14"
"It's moving too slow, but it's generally good to legalize it","1","0.14"
"It's necessary for many reasons.","1","0.14"
"It's ridiculous it's still not legal everywhere, especially given the prevalence of alcohol","1","0.14"
"It's safer than alcohol and the stigma around it needs to be changed. ","1","0.14"
"It's safer than legal prescription & non-prescription drugs with no serious or threatening side affects. It has a higher rate of success for many medical outcomes.","1","0.14"
"It's silly that its still a battle.  This should be legal and way less of a big deal.","1","0.14"
"It's stupid not to. It removes the social problems of drug dealers violent crime and is wildly profitable for states that tax the product. ","1","0.14"
"it's time.","1","0.14"
"It can't happen quicker! I was an alcoholic. If I had tried cannabis I wouldn't have been. The last decade of my life would have been better! And now I'm using it to try to save my life. The irony","1","0.14"
"It comes from the earth... ","1","0.14"
"It has been a long time coming and much needed in comparison to other OTC/street pharmaceuticals ","1","0.14"
"It has been a long time coming, and will only bring positive things to our community!","1","0.14"
"It has helped me drop numerous medications that were prescribed to me, since using cannabis I have stopped a life long battle with biting my finger nails. I am no longer a slave to prescription medication.","1","0.14"
"It has helped my life tremendously ","1","0.14"
"It is 100% necessary to legalize cannabis, destigmatize it, and stop arresting brown and black people for cannabis and allow them to participate and have a voice in the industry. ","1","0.14"
"It is a good thing. ","1","0.14"
"IT IS A NATURAL HEALING AGENT WHICH SHOULD BE LEGALISED.","1","0.14"
"It is a plant anyone can grow. ","1","0.14"
"It is a priority for me when voting. Though I personally benefit, it’s more important for me as an equality/race issue because minorities are being unfairly targeted for use etc and that must be stopped. ","1","0.14"
"It is a very good thing that cannot happen soon enough. The people want their weed, we voted for it and have waited long enough.   All state prisoners serving time for cannabis offenses should have their sentences commuted and all previous offenders should have their records expunged. ","1","0.14"
"it is a wonderful medical medicine ,best I have","1","0.14"
"It is about time, alchohal is far more dangerous. This should never have happened, we have wasted Billions of dollars fighting a battle on drugs, that failed misreavly. All the while creating a true drug problem legally in America through big pharma.thousands have died and gone to jail over marijuana and the truth is it should have been legal and a priority med over opiates and all other drugs. This should be addressed and made right asap.","1","0.14"
"It is essential to provide access for a multitude of reasons, especially medical. I most likely wouldn't have been kicked out of high school for possession of a quarter gram. Legalization will hopefully reduce stigma and redirect law enforcement efforts to more important issues.","1","0.14"
"It is extremely important to me that all states legalize medicinal use of cannabis.","1","0.14"
"It is long overdue and alarmingly slow in it's realization, with misinformation and minimal transparency that feels very wrong considering the vast majority of the people in this state are fully in favor of recreational use","1","0.14"
"It is overdue ","1","0.14"
"It is safer and ""healthier"" than liquor. ","1","0.14"
"It is safer than alcohol! Taxation, education, and regulation are the key. It will reduce the burden on the legal system for non-violent crimes.   When consumed as edibles or vaporized flower, there seems to be almost no negative health impacts.    LEGALIZE! ","1","0.14"
"It is way overdue","1","0.14"
"It is way overdue, although I am concerned about the availability and consistency of medical cannabis when it rec becomes available. ","1","0.14"
"It just needs to be re scheduled at the federal level. ","1","0.14"
"It needs to be available to those who need it most ","1","0.14"
"it needs to be done ASAP","1","0.14"
"It needs to be done federally ","1","0.14"
"It needs to be done. ","1","0.14"
"It needs to be federally legalized. ","1","0.14"
"It needs to be fully legal for any purpose -- and people should be allowed to grow as much of their own as they want. Exchanging different strains and tinctures with other people would be great -- if I could locate others who would be interested in this.","1","0.14"
"It needs to be legal if only to prevent unjust prison sentences","1","0.14"
"It needs to be legalized and accessible to all that need it.","1","0.14"
"It needs to be legalized everywhere so the quality can continue to rise, while the cost drops. Its important to know what I am smoking is safe and has been tested. ","1","0.14"
"It needs to be legalized in the UK.  This is such a powerful medication it should be available to all.","1","0.14"
"It needs to be regulated and a tax benefit for society but i am in favour","1","0.14"
"It needs to happen in more places. Cannabis criminalization is a major way that POC have been funneled into prisons. ","1","0.14"
"It needs to happen soon","1","0.14"
"It never should've been banned","1","0.14"
"It never should have been illegal in the first place. ","1","0.14"
"It saved my life. I dislike the stoner box I am put in from society but that's a small price to pay for a miracle medication. ","1","0.14"
"It should've been done years ago especially for people who used to get in legal trouble for possessing small amounts.","1","0.14"
"It should absolutely be 100% legal and our law makers need to educate themselves first then educate the public on the misinformation they have been receiving about cannabis for over a hundred years.","1","0.14"
"It should absolutely be legal.","1","0.14"
"It should absolutely be legalized.","1","0.14"
"it should be ","1","0.14"
"It should be able to be used normally ","1","0.14"
"It should be available to everyone. ","1","0.14"
"it should be completely federally legal.","1","0.14"
"It should be declassified so they can do study's ","1","0.14"
"It should be decriminalized and legal for recreational use just like alcohol is. Over 21 with valid id which can be used in any state at any dispensary.","1","0.14"
"It should be done to help more people and get eid of the stigma","1","0.14"
"It should be federally legal to grow, process, possess, use, and trade amongst adults. Those with prior marijuana related convictions should have those overturned and records auto-expunged.","1","0.14"
"It should be federally legal with States voting on recreation. ","1","0.14"
"It should be Federally legal!","1","0.14"
"It should be federally legalized.","1","0.14"
"It should be fully legal nation-wide.","1","0.14"
"It should be fully legalized for medical and recreational use with an 18 or 21 year old age requirement unless for medical purposes.. then anyone, any age should have access to it","1","0.14"
"it should be legal","1","0.14"
"It should be legal everywhere, it's the safest drug, period. ","1","0.14"
"It should be legal everywhere. It's not a drug the way the gov classifies it as. ","1","0.14"
"It should be legal federally","1","0.14"
"It should be legal for adults to purchase and consume both for medical and recreational purposes.","1","0.14"
"It should be legal for anyone over 21","1","0.14"
"It should be legal for everyone ","1","0.14"
"It should be legal for recreational use and covered by insurance for those with qualifying conditions ","1","0.14"
"It should be legal in all 50 states just like alcohol","1","0.14"
"It should be legal in every state. ","1","0.14"
"It should be legal nationally. It would bring prices down, slow down black market, decrease heroin use, and keep non criminal drug offenders out of jail. The cons are quite low","1","0.14"
"It should be legal nationwide, cannabis is way safer than booze or tobacco","1","0.14"
"It should be legal on a federal basis.","1","0.14"
"It should be legal on a federal level! ","1","0.14"
"It should be legal on a federal level. ","1","0.14"
"It should be legal so it can be regulated and people can know what they are consuming.","1","0.14"
"It should be legal to all","1","0.14"
"It should be legal.","1","0.14"
"It should be legal.  It has health benefits.  We need more research.  It’s safer than alcohol.","1","0.14"
"It should be legal. It’s insane that it still isn’t. ","1","0.14"
"It should be legalized all states","1","0.14"
"It should be legalized but not made available to minors","1","0.14"
"It should be legalized everywhere. ","1","0.14"
"It should be legalized federally","1","0.14"
"It should be legalized for all purposes, medical, recreational etc. if it legal to grow, buy and sell parsley, cilantro and roses, so should cannabis.","1","0.14"
"It should be legalized in all states.  It helps for everything. There is a strain for everything. ","1","0.14"
"It should be legalized on a federal level. ","1","0.14"
"It should be legalized on all levels especially for children who need the oils","1","0.14"
"It should be legalized without need of a medical card; especially considering that many who use 'recreationally' are using it medicinally without realizing it.  Based on studies of its safety, cannabis is a rather silly thing to prohibit.","1","0.14"
"It should be legalized.","1","0.14"
"It should be legalized.  It is way less harmful than alcohol!","1","0.14"
"It should be legalized. I can go to war or buy liquor which causes more harm than cannabis but I can't legally buy cannabis without a medical card...strange ","1","0.14"
"It should be legalized. I think that those who smoke now aren’t going to stop and those that don’t like it don’t need to start. It won’t change who smokes and who doesn’t its a personal choice. ","1","0.14"
"It should have been legalized for 1000 years.","1","0.14"
"It should never have been illegal","1","0.14"
"it should’ve happened when prohibition ended... lots of taxable money for the USA. hurry up and make it 100% legal to of age customers ","1","0.14"
"It slightly worries me that the patients will become less of a priority AND legalization is important to kill the stigma built up around cannabis. So mixed feelings. ","1","0.14"
"It took long enough ","1","0.14"
"It was great that the ""will of the voters"" was enacted, but the legislation itself, ie. the codes and regulations are extensive and seem to be an effort on behalf of timid legislators to dissuade against recreational use. Communication from the state needs to increase. Most people do not know about the Economic Equity Program - how are you going to attract those people if they do not even know about it? Otherwise, your attempt at progression is futile. Also, advertising the differences between medical and recreational marijuana will be crucial. Other states have seen patterns of medical users turning their reliance solely to recreational dispensaries due to an ease of convenience - but is the weed the same? The benefits of legalization will be realized in time and I wonder in 15 years if legislators will look back and wonder why they didn't allow the ball to get rolling faster...maybe the other issues plaguing the state could've been solved via a tangential relationship we don't even understand yet.","1","0.14"
"It will be life changing for the better","1","0.14"
"It will help the world","1","0.14"
"It’s about time! It’s a plant not the devils lettutce ;)","1","0.14"
"It’s awesome and I want to help in every possible way. It’s about time!!","1","0.14"
"It’s beautiful","1","0.14"
"It’s good I guess but regardless I’m still buying off the street cause I get the same quality for a third of the price ","1","0.14"
"It’s great","1","0.14"
"It’s great ","1","0.14"
"It’s long overdue. ","1","0.14"
