"Why isnt pesticide testing more open for patients. On every label it says it may not meet pesticide standards, gives me more paranoia","1","0.14"
"why prices do not come down","1","0.14"
"why the government has carried on with this prohibition for so long, injuring the american people as a whole","1","0.14"
"With continual consumption, will you need to increase amount consumed to receive benefits","1","0.14"
"Would like to see mandatory cannabinoid and terpenoid profiles on products in order to improve efficacy","1","0.14"
"Would you like more variety in strain6","1","0.14"
"Would you like the price lowered","1","0.14"
"Would you want better testing for cannabis for DUI purposes? How should this testing be applied? (Blood, urine, mouth swab?)","1","0.14"
"Would you work in the cannabis industry?","1","0.14"
"You asked about what meds I'm trying to cut back on with cannabis use not what you have replaced with cannabis use. I am now on zero pharmaceuticals and used to be on up to 6 at a time. ","1","0.14"
"You asked them all ","1","0.14"
"You asked them all.","1","0.14"
"You could ask if I'm pretty loyal to just one dispensary or if I use a bunch of different ones and what my motivation might be either way","1","0.14"
"You covered everything very thoroughly!","1","0.14"
"You covered it all","1","0.14"
"You did a good job. ","1","0.14"
"You didn't ask anything about minority communities negatively affected by prohibition. You should ask whether people think its important for emerging/legal businesses to benefit effected communities. ","1","0.14"
"You didn't ask if I've done political advocacy around cannabis consumption, legalization.","1","0.14"
"You didn’t ask if I ever have felt impaired from using cannabis and which methods of consumption may cause impairment more easily. ","1","0.14"
"You didn’t ask why I am using medical cannabis. I have PTSD, anxiety and depression. ","1","0.14"
"You dont ask about the smell of the weed. for me is extremly important in my choise","1","0.14"
"You guys covered it pretty well","1","0.14"
"You hit everything I can think of right now ","1","0.14"
"You hit them all","1","0.14"
"you should put this question at the very end","1","0.14"
"you were very thorough. you asked everything.","1","0.14"
"You’ve done very well! ","1","0.14"
"Young people should be vaporizing, not smoking.  A great question would be:  Given the known consequences of smoking anything, would you recommend that the new wave of cannabis users, focus on vaporizing?","1","0.14"
