"q52","What questions regarding cannabis did we not ask that are important to you?","n =  1245"
"response","count","percent_responded"
"None","232","18.63"
"none","118","9.48"
"N/A","52","4.18"
"n/a","33","2.65"
"None ","31","2.49"
"N/a","27","2.17"
"Nothing","18","1.45"
"Na","15","1.2"
"Not sure","11","0.88"
"Nothing ","9","0.72"
"na","8","0.64"
"None.","7","0.56"
"not sure","6","0.48"
"Can't think of any","5","0.4"
"Can't think of any.","4","0.32"
"None that I can think of","4","0.32"
"Not sure ","4","0.32"
"idk","3","0.24"
"No","3","0.24"
"none ","3","0.24"
"None  ","3","0.24"
"None that I can think of.","3","0.24"
"Nothing I can think of","3","0.24"
"all good","2","0.16"
"can't think of any","2","0.16"
"Can't think of anything","2","0.16"
"Can’t think of any","2","0.16"
"Can’t think of any ","2","0.16"
"n\a","2","0.16"
"Na ","2","0.16"
"No e","2","0.16"
"none  ","2","0.16"
"nothing","2","0.16"
"Nothing I can think of.","2","0.16"
"Nothing.","2","0.16"
"Price","2","0.16"
"Pricing","2","0.16"
"1) How may I find employment in this growing industry?    2) Will there be training for skilled labor positions (such as kitchen or Lab work) in the industry?","1","0.08"
"A group or message board where I can learn more from people nearby","1","0.08"
"About medical card","1","0.08"
"about my sustained and maintenance care regarding opiate addiction recovery. Survey focuses only on patients who are ""trying it"" ... I've been succeeding for the past 3 years. The information regarding the continued care in this area of recovery that is not ""NEW""OR ""TRYING"" ... but actually succeeding, (questions about ""sustaining success,"" etc)","1","0.08"
"Accepting payments in XLM, XRP, ETH BCH, BTC.","1","0.08"
"Accessibility of retail; questions related to social equity, big business, environmental impact","1","0.08"
"activities enjoyed while medicated","1","0.08"
"Add FECO to list of products used.","1","0.08"
"Advertising","1","0.08"
"Al were good","1","0.08"
"alcohol consumption, when / where do you tend to consume (ie. does that make you a social user?), use of other substance I drugs (ie. is marijuana a gateway), did you start using marijuana before or after you began to drink alcohol regularly? do you use e-cigarettes? do you smoke cigarettes?","1","0.08"
"All","1","0.08"
"All answered ","1","0.08"
"All good","1","0.08"
"All great questions.","1","0.08"
"ALL OF THEM","1","0.08"
"All references seem to be dispensary or budtender based.  Maybe ask how many are using private caregivers and the quality we offer.","1","0.08"
"All seemed to be covered","1","0.08"
"All where","1","0.08"
"Am i a parent. ","1","0.08"
"Am i interested in stronger strains for sleep, relaxation, depression help?  Yes.","1","0.08"
"any Changes you believe can be made to better reform marijuana laws or dispensary’s price , how they are run, etc. any changes that can be made that can better this new cannabis market ","1","0.08"
"Are the patients' needs being met satisfactorily by the supply of dispensaries (No, more demand than available supply)","1","0.08"
"Are there social benefits that cannabis can offer people?","1","0.08"
"Are we satisfied with cannabis legislation at the state or local level","1","0.08"
"are you aware that wax or certain concentrates can ignite on fire if smoked with a pipe?","1","0.08"
"Are you using cannabis to seek relief without a high?  Or, do you have to be high to achieve medical relief?  Or, how important is getting relief without a high to you?  The dosing question should separate THC amount from CBD amount because the total number of cannabinoids is misleading. For example, my daily use is 100mg total, 80CBD 20THC. This put me in high usage category but I don't get high.   A question on how knowledgable friends and family are about cannabis would give a broader understanding of market knowledge.   Where would you prefer to gain knowledge about cannabis could reveal a need for unrealized sources?  Asking more specific questions on pricing of products would reveal the how wide the price range is in the market, i.e. price per mg of each method used. ","1","0.08"
"Are your healcare providers knowledgeable about the specifics of medicinal cannabis use? Not at all!","1","0.08"
"Aroma ","1","0.08"
"As someone who has moved out of state, I would love comparisons made between our flower to say, Colorado or California. I have tried a lot that Massachusetts has had to offer and it just seems to continually fall short. ","1","0.08"
"asd","1","0.08"
"ask whether or not patient wants to feel psychoactive effect or whether that is a problem. ","1","0.08"
"Awareness of medical benefits","1","0.08"
"Balance of CBD to THC","1","0.08"
"Bask","1","0.08"
"Believe you've covered it all in this survey","1","0.08"
"Black market influence, pricing, spectrum of choices, etc. ","1","0.08"
"c","1","0.08"
"Can't remember now","1","0.08"
"can't think of any ","1","0.08"
"Can't think of any ","1","0.08"
"Can't think of any right now","1","0.08"
"Can't think of one","1","0.08"
"can't think of them right now","1","0.08"
"Can I have the right to protect myself with the 2nd amendment and still have my medicine? ","1","0.08"
"can I travel with my medication?","1","0.08"
"can not think of any ","1","0.08"
"Can we give you free cannabis products?","1","0.08"
"Can’t think of any at this moment ","1","0.08"
"Can’t think of anything right now ","1","0.08"
"Can’t think of one","1","0.08"
"Cannabis is calorie free compared to alcohol. Although many feel that cannabis increases appetite, do you feel that cannabis has actually helped you maintain a healthy body weight? (I do not feel that cannabis increases my appetite, and if anything, I feel I eat less since I have been enjoying the benefits of cannabis.","1","0.08"
"Cannabis is not required to be re-tested after extended periods of time at dispensaries. ","1","0.08"
"Cannot think of any at the moment","1","0.08"
"CBD","1","0.08"
"CBD and pets","1","0.08"
"CBD use in particular","1","0.08"
"certified professional help in selecting what is best for my conditions.","1","0.08"
"children consumption - when will that be a thing? for medicinal use of course","1","0.08"
"Clinical trials, the first of which should be how toxic is cannabis?","1","0.08"
"Common negative side effects, common positive side effects","1","0.08"
"Consider specifying differences in patterns of use related to medicinal use vs. recreation use. ","1","0.08"
"consistency of vape cartridges  ","1","0.08"
"Continued availability of educational materials or events to educate medical patients. ","1","0.08"
"Cost","1","0.08"
"Cost pricing","1","0.08"
"Cost....no one pays more for cannabis than Massachusetts mmj patients. Frustrating knowing the western part of the country pays just a fraction of the $ we do for the same product","1","0.08"
"Country wide pricing structure, the west Coast is 1/2 price of East Coast at this present time.","1","0.08"
"Covered everything ","1","0.08"
"covered it well","1","0.08"
"Current Legal ramifications ","1","0.08"
"Demographic information if people want to share- it's good to get a cross section of what type of people are using cannabis now, what careers they have, are they parents/students/ professionals etc.","1","0.08"
"Did you ask about terpene testing or was I just on my soapbox? If you want to gather more good information, add more fill-in boxes. ie. #53-54. I used recreationally when younger, but not much at all as a parent. Then I 'recreated' one evening after developing fibromyalgia and realized this is medicine! Now I use medicinally, and recreate on the occasional weekend. Much prefer cannabis to alcohol. I've done a lot of research & experimentation on it, and enjoy sharing that knowledge with friends and family. Taught a mature friend to smoke for the first time in her life. She now legally consumes regularly to significantly improve her fibro symptoms so she can keep working. Thank you for allowing me to participate in a medicinal cannabis survey without the prerequisite of medicating legally!","1","0.08"
"Did you ever consumed cannabis prior, illegally? and Where you still a regular pot smoker before discovering it as a medicinal tool?","1","0.08"
"Did you grow up in a family where Cannabis was used?","1","0.08"
"Dispensary employees need to understand which terpenes are good for different ailments.  ","1","0.08"
"do  you feel cannabis is more or less safe than alcohol. & i  would answer alcohol is far more dangerous & is the gateway drug to be concerned with. not cannabis","1","0.08"
"Do I prefer cannabis over pharmaceuticals?   Hell yes!","1","0.08"
"Do you believe that your primary care doctor believes in the stigma or will help you?","1","0.08"
"Do you feel any symptoms of addiction?  Do you regularly mix cannabis with alcohol or other drugs.  What recreational drugs do you take?","1","0.08"
"Do you feel comfortable consuming cannabis in your housing ?  ","1","0.08"
"Do you grow your own medical marijuana?","1","0.08"
"Do you know about the dry and cure process and how important it is?","1","0.08"
"Do you know anyone else with a medical card ","1","0.08"
"Do you know someone who grows","1","0.08"
"Do you know the difference between indica & sativa?","1","0.08"
"Do you know the dosage recommended to treat patient ailment based on patient profile and symptoms. (NO).  Is cannabis treatment resolving the targetted medical issue? (Not yet, small glimmer of resolution, but too much trial and error on dosing and no real answers from previous practices to follow).","1","0.08"
"Do you make any cannabis products for yourself?","1","0.08"
"Do you think cannabis has different effects on females vs. males ?","1","0.08"
"Do you think Medical Doctors need education related to marijuana ","1","0.08"
"Do you think that it’s unfair to have to worry about traveling with this medicine. It’s ok to have those opioids in your daily pill box or benzodiazepines but that cannabis is a issue when flying or traveling in general. ","1","0.08"
"Do you think the individual states with legalized cannabis will get over their greed and cut taxes?","1","0.08"
"Do you think the US government should actively increase research into the medical benefits of cannabis? Do you think that the federal government discriminates against people of color/people with drug-related criminal histories? (YES)","1","0.08"
"Do you think there should be public smoking establishments? Example- lounges/gyms","1","0.08"
"Do you use cannabis for your pets or a caretaker for loved ones","1","0.08"
"Do you want some?","1","0.08"
"Does cannabis affect your medical condition?","1","0.08"
"Does cannabis treat the symptoms you experience on a daily basis? ","1","0.08"
"Does it matter to you if it’s grown organically ","1","0.08"
"Does my spouse use cannabis? She doesn't. And anecdotally, I've come across a number of others in the community where this is also the case. ","1","0.08"
"Does your local dispensary provide currant lab test results including mold and pesticide levels ","1","0.08"
"Don't have any","1","0.08"
"Don't have any feedback. ","1","0.08"
"Don't have any right now","1","0.08"
"Don't have any.","1","0.08"
"Don’t have any questions","1","0.08"
"Don’t know","1","0.08"
"Don’t know ","1","0.08"
"Dont know","1","0.08"
"Dosage and type of cannabis for lung cancer that is NED ( no evidence detected)","1","0.08"
"dose of cbd separate from thc.  expirience with terpenes.  condition specific info.  ","1","0.08"
"dosing","1","0.08"
"Dosing schedules ","1","0.08"
"drug/drug interactions and more about testing and cultivation parameters","1","0.08"
"dunno, like I said earlier, I'm just exploring this","1","0.08"
"🤷‍♀️","1","0.08"
"Ease of access. I smoke whatever is easiest for me to access","1","0.08"
"ease of getting license","1","0.08"
"Economic ","1","0.08"
"Education is important.  What are some areas that new patients require to be able to make their own medications?","1","0.08"
"Education programs on growing and juicing. ","1","0.08"
"educational resources to continue education & support groups","1","0.08"
"effect on mood","1","0.08"
"effect on prices and illegal pot vs pharma","1","0.08"
"Effects and recommended use by ailment","1","0.08"
"Effects of job scrutiny for disabled persons that ""use"" cannabis throughout the day to numb the daily pain levels enough to function at a more ""normal "" acceptable level. ","1","0.08"
"fda","1","0.08"
"Federal legalization, and the education of the masses.","1","0.08"
"Federal vs State law issues, including banking","1","0.08"
"Feeling about legalisation ","1","0.08"
"Financial burden having to pay out of pocket for my medicine","1","0.08"
"Flavor importance","1","0.08"
"For those who have come off of opiates and other drugs, there were only questions about present use, not past use. More questions about policies and knowledge of staff at dispensaries","1","0.08"
"Future of medical marijuana","1","0.08"
"Getting into the biz","1","0.08"
"Getting more information about getting a medical card ","1","0.08"
"Good job. Thanks ","1","0.08"
"Has cannabis usage lowered my physical pain?","1","0.08"
"Have anyone in the history of cannabis use ever overdose. ","1","0.08"
"Have i or anyone i know been disproportionately affected by cannabis related crimes prior to the recreational release","1","0.08"
"Have you been impacted by criminalization, & how that effects current ability to use. ","1","0.08"
"Have you mentioned cannabis to your doctor and if so what was the response.  OR  What are you thoughts on talking to your healthcare provider about using medical cannabis as a treatment option?","1","0.08"
"Help us to be aware of legislation that needs our attention for cannabis legalization.","1","0.08"
"Hemp relation","1","0.08"
"Home test cheap enough to use","1","0.08"
"How are people with MS, Parkinson’s, etc being taught how to use","1","0.08"
"How are we going to make cannabis available to everyone for medicine, not just those with money. It seems like the industry is getting just as greedy as big pharma with lots of people out for a buck","1","0.08"
"How are you concerned about negative health risks associated with cannabis?","1","0.08"
"how can I grow clean plants for my own use when I don't have a green thumb?","1","0.08"
"How can it be made available to people of less means? I work inner city, and come across many poor people who would benefit but cannot due to cost.","1","0.08"
"How can one know they will not get bad pot? Meaning pot laced w something dangerous and deadly. ","1","0.08"
"How can we end the war on the poor and the war on drugs? How can we help those who have been abused by the justice system because of a plant?","1","0.08"
"How can we get the cost defrayed the government saves $4000 a month on my meds alone and I’m destitute ","1","0.08"
"How can we move from stigma to real science and mainstream medicine?","1","0.08"
"How can we promote more scientific research into the use and effects of cannabis?","1","0.08"
"How comfortable are you with the quality of the bud you are receiving?","1","0.08"
"How difficult (or easy) is it to find a medical health professional who can advise / prescribe medical cannabis?  ","1","0.08"
"How do I determine the correct dosage to cure my chemo related nausea.","1","0.08"
"How do I feel about jobs still testing for marijuana use regardless if you have a medical license or not?","1","0.08"
"HOW DO I FEEL ABOUT PAYING SO MUCH!!!!!","1","0.08"
"How do I get my cannabis product:  If I do not get my cannabis in the dispensary, how and where do I get it.   How many online dispensaries do I get my cannabis from.  do I have it shipped from out of state.","1","0.08"
"How do the people you live with feel about your cannabis use?","1","0.08"
"How do we think the state is doing implementing leagl canabis","1","0.08"
"How do you feel about legalizing marijuana for recreational use","1","0.08"
"How do you feel about the black/grey market? Not good, the community rips itself apart from the inside due to greed, I don't know if it would be different if it was completely legal but this infighting would happen within companies not in the community for everyone to feel uncomfortable.","1","0.08"
"How do you select a cannabis doctor?","1","0.08"
"How Does cannabis effect your spiritually?  ","1","0.08"
"How does cannabis help you?","1","0.08"
"how does cannabis impact your relations with other people?","1","0.08"
"How does cannabis improve healing beyond just consuming it.","1","0.08"
"How does cannabis make you feel?","1","0.08"
"How does cannabis use increase an active lifestyle?","1","0.08"
"How does indica and sativa affect you differently? Do you know the difference in strains and why they are different? ","1","0.08"
"How does it feel if you consumed?  ","1","0.08"
"How does using cannabis make you feel and how does it help in your daily life?","1","0.08"
"How easy is it to access cannabis in your area?","1","0.08"
"How easy is it to get a Green Card for use of marijuana?","1","0.08"
"How far do you have to travel to obtain Cannabis from a dispensary?","1","0.08"
"How happy it makes me :)","1","0.08"
"How I feel about pricing and whether insurance companies should be forced to cover cost","1","0.08"
"How important is cannabis in terms of quality of life","1","0.08"
"How important is it that you have consistent access to your favorite strain?","1","0.08"
"how important is it to have a physician/care giver monitor and prescribe cannabis for your treatment.","1","0.08"
"How important is it to know how, where, and with what intention the cannabis was grown? ","1","0.08"
"How it effects daily life?  How it effects users socially, or in interpersonal relationships.   ","1","0.08"
"How knowledge of cannabis was acquired ","1","0.08"
"How long Cannabis are really still fresh?","1","0.08"
"How long does effects last.","1","0.08"
"How long have been using","1","0.08"
"How long have I been using marijuana? ","1","0.08"
"how long have I smoked cannabis","1","0.08"
"how long have i used?","1","0.08"
"How long it takes to get to a dispensary. Do you have a dispensary in your neighborhhood. ","1","0.08"
"How many years have you had your mmj certification for?","1","0.08"
"How much do you love cannabis","1","0.08"
"How much is the right price","1","0.08"
"How much more cannabis would you use if you could afford it?","1","0.08"
"How much should cannabis cost.","1","0.08"
"How often and how much","1","0.08"
"how often do you consume cannabis with recreational users?","1","0.08"
"How old are you? When did you receive your mmj certification?","1","0.08"
"How old when you first started using cannabis?","1","0.08"
"how people can trust varying test results from different labs and are dispensaries properly labeling products.","1","0.08"
"How pricing is determined. It's way to expensive.","1","0.08"
"How this would affect pharmaceutical companies if pass fedderly.","1","0.08"
"How to determine mg of product and how much to take","1","0.08"
"how to dose","1","0.08"
"How to grow in home and where to get seeds and starter plants","1","0.08"
"how to improve the dosage to improve the health benefits","1","0.08"
"How to keep away from children","1","0.08"
"How to maintain supply of favorite strains.","1","0.08"
"How to make delivery more convenient.dispenseries have different strains, maybe to far to travel to","1","0.08"
"how to obtain grow license","1","0.08"
"How to talk to your kids so you aren't worried about what they say to others.","1","0.08"
"How we felt about the need for credible research to be done, so that we would have a better idea of proper dosages and administration.   (I feel this is incredibly important!)","1","0.08"
"How well canvas works for you","1","0.08"
"How will adult use legalization affect the medical market?","1","0.08"
"How will the money that the pot industry is projected to generate, which is billions of dollars, affect the quality of the product, the quality of the individuals providing it and the product's availability?","1","0.08"
"How will this survey help with the stigma of cannabis; how will this assist with cannabis being recognized as an alternative to opioids for pain medication. ","1","0.08"
"How will you flush out those who are taking advantage of the market with crap product","1","0.08"
"How would I like to see central testing and certification of cannabis products.","1","0.08"
"Hybrid strain info","1","0.08"
"I'd like to know about what age people think it is best to start use on a regular basis","1","0.08"
"I'm good ","1","0.08"
"I'm happy with the questions","1","0.08"
"I'm not sure","1","0.08"
"I'm pretty satisfied with the questions asked so far","1","0.08"
"I am curious about the best time to consume edibles- before, after or during meals.","1","0.08"
"I am really concerned that there is insufficient training among Clinic and Licensed Provider staff to adequately coach patients about which products will work best for their condition.  Here, we are offered (oils) CBD, THC, 1:1 ; without looking at terpenes.  I have found a vast difference from one LP to another.  One CBD product worked beautifully and the other, not at all.","1","0.08"
"I am very interested in how dispensaries will handle medical and recreational. For example I have heard of separate lines and guaranteed inventory for medical card holders. So I am interested in how recreational legalization will affect my experience as a medical card holder.","1","0.08"
"I can't think of any","1","0.08"
"I can't think of any at the moment.","1","0.08"
"I can't think of any at this time","1","0.08"
"I can't think of any. ","1","0.08"
"I can't think of anything","1","0.08"
"I can't think of one","1","0.08"
"I can't think of one at the moment.","1","0.08"
"I can’t think of any ","1","0.08"
"I can’t think of anything, at this time.","1","0.08"
"I can’t tolerate THC, I have hallucinations, anxiety, it’s horrible. In the 70’s I tried smoking pot and I came to conclusion that it wasn’t for me.","1","0.08"
"I cant think of any","1","0.08"
"I don't know. It should not be a crime anywhere to use the only medicine that is known to help your condition, like Alzheimer's. It's terribly scary to not know where you are.","1","0.08"
"I don't know?","1","0.08"
"I don’t ask questions unless it’s about the price because you people are ridiculous with the price you charge ","1","0.08"
"I don’t have any questions .","1","0.08"
"I don’t have more?","1","0.08"
"I don’t know","1","0.08"
"I don’t know. ","1","0.08"
"I have none","1","0.08"
"I have none at this time","1","0.08"
"I have none!","1","0.08"
"I honestly have no idea.","1","0.08"
"I smoked recreationally when I was younger. Now, I'd like to see more newbie education","1","0.08"
"I think the medical card should last more than a year. I have gotten off Fentanyl with the use of CBD and THC. I do have belly pain though from the Whipple Surgery","1","0.08"
"I think you've covered most things. ","1","0.08"
"I think you've got it","1","0.08"
"I think you covered it","1","0.08"
"i think you covered it all","1","0.08"
"I think you covered it all","1","0.08"
"I think you covered it well.","1","0.08"
"I think you covered it.","1","0.08"
"I think you covered them","1","0.08"
"I think you covered them all.","1","0.08"
"I want to see doctors working with dispensaries and this survey gives me great hope ","1","0.08"
"I would fully support federal and state tax money being used to properly research cannabis. I would not support pharmaceutical companies patenting the molecule, and I would not consume cannabis that has been neutered into a pill. ","1","0.08"
"I would like more info on dosing to achieve maximum results for different conditions. ","1","0.08"
"I would like to get more specific about the prices, availability, and certain dispensories.","1","0.08"
"I would like to know how we can lower the price enough to allow me to not have to ration it. I might be able to lower my opiods if I could actually afford to buy the amount I really need.","1","0.08"
"I would like to see questions regarding how long it took to get to a therapeutic level and also if people are using it for their pets and what effect it has had.","1","0.08"
"I would love to know a thorough, non-biased view of how risky smoking flower is for things such as lung cancer. I also would love to know more about vape cartridge risk, particularly if it's okay to use within plastic cartridges, how to know if the distillate is breaking down, negative potential effects, etc. ","1","0.08"
"I would love to know how to refine dosing and strains for my particular issues. ","1","0.08"
"I’m concerned about cannabis remaining highly stigmatized due to employment drug testing. Legalization and more supportive research will accomplish nothing if people are afraid to consume due to drug screenings. ","1","0.08"
"I’m good ","1","0.08"
"I’m not sure","1","0.08"
"I’m not sure. ","1","0.08"
"Idk","1","0.08"
"If cannabis is a medical thing, why isn't it covered by insurance?","1","0.08"
"If I can afford to pay for the only thing that helps my pain and if I can or can't afford it","1","0.08"
"If I know what specific strains treat for medical needs ","1","0.08"
"If legal - is there an age limit?  What about teens in other states?  ","1","0.08"
"If there will ever be federally recognized as medically needed form of treatment covered under insurances. Would love to see more affordable pricing at dispensary for those with conditions as states move forward to legalizing use for all. ","1","0.08"
"If whether or not I believe insurance companies should be responsible for assiting with paying for cannabis. They already pay for deadly drugs, drugs which have a proven track record of abuse.","1","0.08"
"If you've felt the need to stop using marijuana and couldn't","1","0.08"
"if you did not use cannabis for medical reason would you use it for recreational purposes?","1","0.08"
