"You didn’t ask if I ever have felt impaired from using cannabis and which methods of consumption may cause impairment more easily. ","1","0.08"
"You didn’t ask why I am using medical cannabis. I have PTSD, anxiety and depression. ","1","0.08"
"You dont ask about the smell of the weed. for me is extremly important in my choise","1","0.08"
"You got it all that I can think of","1","0.08"
"you got them all","1","0.08"
"You guys covered it pretty well","1","0.08"
"You hit everything I can think of right now ","1","0.08"
"You hit them all","1","0.08"
"you should put this question at the very end","1","0.08"
"you were very thorough. you asked everything.","1","0.08"
"You’ve done very well! ","1","0.08"
"Young people should be vaporizing, not smoking.  A great question would be:  Given the known consequences of smoking anything, would you recommend that the new wave of cannabis users, focus on vaporizing?","1","0.08"
