"It’s time! (I wrote a merchandising paper on this in 1979) There are therapeutic benefits. When you buy on the black market you have no idea of the source , how it’s been processed and what other “ingredients’ may have been used  There are so many different strains that work differently on your mind and body. There would be on hand staff with knowledge to guide the consumer in a safe environment   It would boost the economy     ","1","0.42"
"It’s way overdue, the current criminalization of pot is discriminatory. It’s not a potent enough drug to require criminal/legal enforcement. Regulations and education are all that is needed","1","0.42"
"Its not just about my personal life, but there are many lives who are in prison due to use of/ or possession of marijuana. I don’t think most of those individuals deserve the time. ","1","0.42"
"Its safer the alcohol and will open up more freedom for hemp farms.","1","0.42"
"Legalization for adult use will inevitably increase underage use as well, no matter that it will be regulated (see how well alcohol is regulated and the amount of underage drinking that is prevalent?)  This drug still has many unknowns and should not be legalized for recreational use -- PERIOD!","1","0.42"
"Legalization will bring positive social and economic changes to this state.","1","0.42"
"Legalization with taxation will help the economy.  It will also stop the discrimination against blacks vs. whites when caught with and arrested with weed. ","1","0.42"
"Legalizing cannabis in NJ can potentially improve the economy by raising taxes. Marijuana can kill cancer cells, the US government has confirmed. Cannabis could actually be the safest drug available, after a study found it is actually 114 times less deadly than alcohol. This will also increase job opportunities as many people would start working in the cannabis industry, if legalized. ","1","0.42"
"legalizing recreational marijuana will 110% add billions to the economy, create hundreds of thousands of jobs, and stop the racial disparities in cannabis enforcement. It is said to be safer and less harmful than alcohol, which says a lot in its own why cannabis should be legal. ","1","0.42"
"Legalizing the use of cannabis by adults would provide an opportunity for economic growth as well as lower the number of arrests for non-violent drug charges. ","1","0.42"
"Makes Economic sense, eases criminal Racial disparity in enforcement, recreational use would make it easier for people to use it medicinally without the hurdles of the medicinal program ","1","0.42"
"Many health benefits will no side effects. ","1","0.42"
"Many people do it, make it legal","1","0.42"
"Marijuana has a unfair stigma in comparison to other legal substances like alcohol. Decriminalizing will hurt illegal drug trade, reduce incarceration , reduce burden on police and benefit tax revenue for social programs and education. ","1","0.42"
"Marijuana is inappropriately categorized as a schedule 1 drug, leading to harsh, unfair and unnecessary criminalization. The drug is no more addictive or dangerous than tobacco or alcohol and is only linked to overdoses when taken with other, more dangerous drugs. In addition to potentially having a positive impact on state economy, and hopefully a reduction in race based discrimination in the criminalization of marijuana use, legalization would also make marijuana safer to use because it can be more easily regulated to make sure it has not been tampered with, meaning there would be fewer instances of overdoses linked to marijuana. ","1","0.42"
"Marijuana is proven to have therapeutic effect and is used by many to decrease anxiety stress and pain. People who go to jail over possession of marijuana are much more likely to POC than white. Legalizing marijuana would help reduce this discrepancy and would all everyone to benefit from the therapeutic effects of marijuana.","1","0.42"
"Medical and taxation benefits outweigh cons","1","0.42"
"Medical use to lower costs and for the economy. ","1","0.42"
"Medically and psychologically it can be very helpful! ","1","0.42"
"Medicinal","1","0.42"
"MMJ has made my battle with MS, aniexty, adhd, etc... easier. It helps w sleep, pain, spasms, headaches","1","0.42"
"My own personal use and i positively think it will help the economy ","1","0.42"
"N/A","1","0.42"
"New form of tax revenue for the state","1","0.42"
"No different than alcohol ","1","0.42"
"Not as harmful as alcohol  It will be good for the economy   It’s long overdue","1","0.42"
"Not sure yet. ","1","0.42"
"Nothing wrong with marijuana use","1","0.42"
"People are using Cannabis so why shouldn't New Jersey benefit from the tax of Cannabis.","1","0.42"
"People are using it anyway, some are getting arrested etc. so why not get some tax revenue from cannabis. It's safer than alcohol too.","1","0.42"
"People should not be in jail for smoking marijuana. It’s time to make space for real criminals ","1","0.42"
"People use it anyway...may as well make tax money on it.  Also medical cards are given out like candy,but the price of medical marijuana is obscene","1","0.42"
"People who want to use cannabis are using it.  I see potential economic opportunity","1","0.42"
"Perhaps our government can control it .   Except for Murphy!!!","1","0.42"
"Person reasons","1","0.42"
"Personal use","1","0.42"
"Politics ","1","0.42"
"Positive Impact on NJ","1","0.42"
"Positive impact on racial disparity, economic conditions of the state, physical and psychological medical benefit to adults, catch-up to other states.","1","0.42"
"Presently a medical user and some people could benefit but can't afford docs and get crap from the street ","1","0.42"
"Primary because there is too much red tape to use the drug for medicinal purposes and because our criminal justice system has abused people with our current drug laws. ","1","0.42"
"Profitability for the state ","1","0.42"
"Recreationally, cannabis is much safer than alcohol. Medicinally, cannabis helps control pain, seizures, muscle spasms, anxiety, and more. It is not addictive and regular users are generally more relaxed and happy. And legalizing cannabis and expunging the records of people currently or previously incarcerated for marijuana violations will be the first step in reforming our justice system that disproportionately arrests and convicts black people for these “crimes.”","1","0.42"
"Shouldn’t be illegal. Will reduce arrests for smaller amounts","1","0.42"
"Slippery slope to legalizing harder drugs. ","1","0.42"
"State is loosing money on illegal Cannabis. It can be taxed also people with health condition can have access to cannabis for medical reason.","1","0.42"
"The crime statute punishes a user, punish perhaps the seller and treat the user ","1","0.42"
"The economic and social benefits from legalization of cannabis outweigh the negatives.","1","0.42"
"The high from Marijuana is the same as having alcoholic beverages. In my opinion I think with marijuana useYou are more aware of your surroundings. Like any other mind altering substance, you have to know your limits and stay within them","1","0.42"
"The impact to the states debt and economy will be helped by the legalization as well as potentially driving down violent crimes.","1","0.42"
"The science is sound and we need to decriminalize and reap the benefits of legal weed. ","1","0.42"
"The time has come to move forward","1","0.42"
"There are many medicinal uses, and we need to end the disparity of minority arrests/incarceration for weed compared to Caucasian arrests/incarceration for weed. Legalize it and regulate it - build profits for our state and end the unneeded shame for those who use it","1","0.42"
"There are more criminal acts than cannabis use.  It has medical advantages and should be more readily available to those that need it.  The revenue could help the state as well","1","0.42"
"There are proven benefits from the utilization of cannabis for medical needs plus you never hear about two cannabis users getting into a fight, only alcohol induced fights. It’s not a dangerous substance, legalizing could help with any budget deficits and reduce/remove sentences for folks that shouldn’t be in jail for cannabis. ","1","0.42"
"There are so many positive uses of cannabis. I believe it is safer than alcohol. ","1","0.42"
"There has never been a real proven basis for outlawing it. It's about time.","1","0.42"
"There hasn’t been any actual problems with people using marijuana. It’s mostly the racist and ethical disparities that are the problem, people get into more problems with it more than marijuana gives them problems. ","1","0.42"
"There is no reason adults should be penalized for using cannabis. By legalizing, we not only save on enforcement costs, the state also gets additional tax revenue that doesn't have to come from elsewhere (property tax, etc.).","1","0.42"
"There will be more consumption and leads to addiction","1","0.42"
"There’s already a lot of cannabis usage  despite it not being legal. However, the legalization of adult-use cannabis can have a positive impact on the community.","1","0.42"
"This is an outdated law against cannabis use that needs to be changed. The medical uses alone prove to be a benefit to people and I do not feel that safe recreational use will cause negative effects on society.","1","0.42"
"This will make it more accessible for those suffering conditions that do not get covered by current medical use of cannabis or those who can not afford to get medical clearances. It will be good if it is monitored like alcohol so those using it recklessly will need to be accountable but overall those who have been punished for having it on their person will no longer be treated as criminals as long as they are using correctly.","1","0.42"
"To decriminalize marijuana is to end unnecessary jail and prison terms, as well as bring a much needed source or income to our state along with jobs.","1","0.42"
"To fight racial disparities within the criminal justice system","1","0.42"
"To help decriminalize offenders who are spending longer in prisons than others who commit violent crimes. ","1","0.42"
"To help get rid of overcrowding in prisons from cannabis charges ","1","0.42"
"To help the economy ","1","0.42"
"To lessen the systematic racism when it comes to charging people of color to extreme sentences because of marijuana.","1","0.42"
"to stop criminalization of a pleasant and harmless  substance","1","0.42"
"Typically money has been sent by states towards public programs, such as housing initiatives and parks and rec centers","1","0.42"
"Uhmm... I am voting no. ","1","0.42"
"Unsure how to vote; legalizing marijuana is opening the gate for other drugs to be laced with cannabis use.","1","0.42"
"Voting for legalization ","1","0.42"
"Voting for, because if alcohol and tobacco are legal so should this.","1","0.42"
"War on drugs has largely been a failure and is a drain on our law enforcement resources and court system. ","1","0.42"
"We are jailing people for a ""drug"" that is no worse for you than alcohol.  Most of those people are people of color, which is wrong.  Legalizing marijuana can possibly give police something better to do with their time, rather than chasing down people with a bit of weed on them.      Additionally, cannabis could provide pain relief in lieu of using prescription pain medication that is far more harmful for people than cannabis.      It's a no brainer to legalize it.  ","1","0.42"
"Weed is cool. ","1","0.42"
"When not abused, as with alcohol use, I don't think it is a problem.","1","0.42"
"While I like the fact it will niko get be criminal the side affects of legalization is unknown","1","0.42"
"While I oppose incarcerating people for marijuana usage, I also oppose outright legalization of a mind-altering drug. There will be many more people driving under the influence resulting in more accidents, injuries, and deaths. It will be harder for employers to maintain drug-free workplaces. Marijuana is not a harmless substance. Street-level product often has impurities and other substances added including ones that are far more dangerous, like PCP. Just because it is legalized doesn't mean everyone will start buying it at their local dispensary where prices are way higher.","1","0.42"
"While I personally do not agree with smoking marijuana in public where anyone can be exposed to it, I do not feel it is harmful enough for the government to ban it.  I also feel it is a waste and unjust strain on law enforcement trying to enforce prohibition of such an already vastly available substance. ","1","0.42"
"While it makes me uncomfortable as I am fairly conservative, I do believe in the end it will be better for our economy. ","1","0.42"
"Why not","1","0.42"
"Words","1","0.42"
