"q10","In your own words, why are you voting for or against adult use cannabis legalization?","n =  239"
"response","count","percent_responded"
"It's about time ","2","0.84"
"Unsure","2","0.84"
"1) I do not see a problem with marijuana   2) it’ll help the economy with taxes and help prison overcrowding ","1","0.42"
"A lot of public funds are wasted trying to enforce cannabis outdated laws that could be spent better elsewhere to help the economy in New Jersey.","1","0.42"
"A lot of the laws regarding cannabis are a part of systematic racism. The state can benefit from taxing cannabis sales. ","1","0.42"
"Adults should have the freedom to consume cannabis legally if they choose. I believe it is safer to consume than alcohol which is already legal.","1","0.42"
"Adults that need it for pain management can get it without jumping thru hoops with doctors and insurance ","1","0.42"
"Alcohol has been legal for years and the effects of it are far worse then cannabis. It will help the economy as alcohol does. ","1","0.42"
"Alcohol is so much worse and the tax revenue is very much needed.","1","0.42"
"America has seen progress in recreational cannabis throughout California, Colorado, Oregon, Washington, Massachusetts and Illinois. Crimes involving cannabis are down. The economic progress of these areas has climbed from the taxes on cannabis. It is safer to know where you are getting the cannabis from, rather than something from the street that could be laced. The challenge for NJ is to tax it fairly. Such as California, who taxes a modest 10% which makes it cheaper, safer and better than street cannabis.","1","0.42"
"An opportunity for reparations","1","0.42"
"As a part of criminal justice reform.","1","0.42"
"As an adult, I should have the right to alter my state of consciousness however I so choose. ","1","0.42"
"At age 71, I experienced a long period where all the information on the benefits was not available ir even being investigated.  From what I have learned, this product’s benefits should be available to all nit only through costly out if pocket scripts but also OTC. ","1","0.42"
"Bc it’s ridiculous that it’s still illegal. Plenty of other things that are more dangerous are legal, e.g. alcohol. ","1","0.42"
"Because cannabis has a lot of benefits.  ","1","0.42"
"because it did not offer economic relief in states that approved its use.","1","0.42"
"Because it should have never been i illegal.   ","1","0.42"
"Because its amazing medically and socially. Too many people are arrested, penalized, and stereotyped because of it.","1","0.42"
"Because marijuana has historically only been illegal for one race in this country. ","1","0.42"
"Because nobody has died from marijuana and it is illegal, yet, people die everyday from alcohol and it is legal.. marijuana is a plant not a drug & it helps people with pain and allows them to become introspective.. in addition to that, there are many people who are incarcerated for selling a non lethal plant and they need to be freed upon legalization.","1","0.42"
"Because other drugs are legal, why should this one not be?","1","0.42"
"Because the positive effects far outweigh the negative. So many things that this could help.","1","0.42"
"Being passed by most states   New Jersey needs the revenue . maybe they'll stop raising all the other state taxes!!","1","0.42"
"Beneficial to the the economy financially. ","1","0.42"
"Benefits for health, relaxation and healing ","1","0.42"
"Besides the many medicinal purposes, I feel that it is safer than alcohol (less accidents and alcohol-fueled domestic  disputes). Also think it will be less of a burden on our judicial system and is a state revenue benefit. ","1","0.42"
"Blacks and hispanics have been sentenced for way too long because of the illegalization of weed. Plus I think ironically, less people would be inclined to smoke if it was legal. ","1","0.42"
"Cannabis has a very high therapeutic index, which means there’s very little, if any, chance of an overdose. It is non-addictive and less dangerous than other legal drugs, such as alcohol and tobacco. It would bring in more tax revenue to the state and it would be safer to consume if it’s legalized (lower risk of it being laced with other drugs that could be potentially fatal). There is inconclusive evidence that marijuana is a gateway drug and it would be safer for people to consume it legally. It’s obscene that people are jailed for non violent crimes of possession or use of marijuana, which leads to overcrowding of our prisons. Not to mention the disproportionately that black people are arrested for drug charges. ","1","0.42"
"Cannabis has medical benefits and will help the economy.","1","0.42"
"Cannabis heals depression, anxiety. Pain, excellent for cancer patients.   will make a cleaner society over opiods and other prescription drugs.  Less alcohol use.   More revenue in New Jersey ","1","0.42"
"Cannabis is a plant that grows naturally. It is a safe alternative to pain killers and has not shown to be addictive. Some studies show it is safer than alcohol.  States that have legalized it recreationally (Colorado) have seen positive impacts on the economy as well. ","1","0.42"
"Cannabis is natural and should be legal.","1","0.42"
"Cannabis is no worse than alcohol (IMO it’s actual less dangerous than alcohol usage). If alcohol and cigarettes are legal and being taxed so too should cannabis. In addition, the number of lives that are destroyed because of the criminalization of cannabis is far too great. The War on Drugs has resulted in far too many young people (and disproportionately people of color) being sent to prison over a victimless “crime”. ","1","0.42"
"Cannabis is not a drug addiction threat.  Making it legal will help reduce the burden on the legal system. ","1","0.42"
"Cannabis is used for many medical reasons and I have seen the results of cannabis use on people with medical cannabis and its positive effects.","1","0.42"
"Cannabis should no longer be considered a drug. There's a lot of negative connotations with cannabis and it's time to debunk that.","1","0.42"
"Cannabis should not longer be substance worth criminalizing people for. There are many benefits to cannabis use.","1","0.42"
"Cannabis, unlike other things provided in the market (i.e. cigarettes) are a better alternative because there are no direct chemicals in it. If people are going to use cannabis anyways, might as well control the conditions in which it can be used, and decriminalize it.","1","0.42"
"Cannabis, when used correctly, can serve as a natural and effective substitute to medication used by those in pain. With cannabis, there won’t be any lasting or life threatening side effects compared to what you may run into with taking multiple kinds of pills.","1","0.42"
"Dangerous ","1","0.42"
"Deciding one chemical is worse than another is arbitrary. Alcohol is so much worse.","1","0.42"
"Decriminalize cannabis.","1","0.42"
"Economy","1","0.42"
"Economy and POC benefits ","1","0.42"
"Financial Considerations","1","0.42"
"For a number of different reasons.  Personally, I would like the option to use it recreationally.  For our society, I think it is currently policed unfairly based on the color of a person's skin.  Far too many people of color are incarcerated in comparison to white people for cannabis-related charges.  I also think by legalizing it, it will be safer to purchase and will not connect young adults with drug dealers - who could go on and offer them stronger, more addictive, more deadly drugs to purchase.   ","1","0.42"
"for adult use. bc cannabis is illegal in many us states, illegal use of the drug disproportionately affects black americans and other people of color. they are sentenced to unreasonably long jail times or high fines when caught with the drug, and often fall victim to police brutality. this does not affect white americans in the same way as they get lesser sentences (if they get sentenced to jail or even arrested at all) legalizing cannabis can help reduce the amount of black americans and poc in jail and hopefully change the way certain people view the drug.","1","0.42"
"For because it appears to have therapeutic value","1","0.42"
"For pain control, use it in my pain practice as an Apn. To generate income for NJ to hopefully lower our taxes. ","1","0.42"
"Freedom","1","0.42"
"Help economy","1","0.42"
"I'm voting against this because I believe cannabis is more of a gateway drug than alcohol. I'm also against this because I think that our state government will waste and exploit the revenue from this.  ","1","0.42"
"I'm voting for it because I believe the legalization of cannabis will provide legislation to expunge wrongfully issued and harsh criminal charges, especially for minorities, create a more competitive market for medical marijuana, thus helping those using it to avoid using opioids, thereby helping to combat the opioid crisis the state (and country) is facing, as well as providing an additional source of income for the state that can help to lower or eliminate other taxes (like the gas tax) to help benefit those who reside in the state. With that said, I do believe consumption should not start until age 25, as that is when the brain has stopped it's development. ","1","0.42"
"I've always thought it should be legal, with reasons including 1. how much the plant helps people with certain disease states and 2. the disparity in arrests of POC vs caucasions","1","0.42"
"I am a nurse, I've seen chronic pain patients benefit, medical marijuana is costly, out of pocket, it would make it more affordable for patients, more accessible, ","1","0.42"
"I am a person who could not take any pain killers for my bone on bone knee which was vso painful it kept me up at night...the only thing that gave me a goodnight sleep was to smoke some weed..","1","0.42"
"I am all for the legalization of adult-use cannabis along with re-evaluating those imprisoned for infractions for the use of cannabis.  I would prefer cannabis consumption in all forms other than smoke inhalation.    I strongly believe in the use of medicinal marijuana and a health benefit.","1","0.42"
"I am an advocate for medical marijuana and hope one day it's federally legal. ","1","0.42"
"I am because it has benefits. ","1","0.42"
"I am currently not eligible to vote but if I were, I would for adult-use cannabis legislation because the data and research from other states that have legalized cannabis demonstrate economic stimulation. Additionally, cannabis has many positive uses such as to treat anxiety and seizure disorders, among other things.","1","0.42"
"I am extremely concerned with the carelessness and lack of clarity associated with drug usage.  Driving while high is very disturbing to me.","1","0.42"
"I am not sure ","1","0.42"
"I AM NOT VOTING FOR LEGALIZATION","1","0.42"
"I am sick of this insanity trying to keep this plant illegal. It is absolutely ridiculous!!!! ","1","0.42"
"I am voting against if","1","0.42"
"I am voting for adult-use cannabis legalization because I believe it is time. I think that, when weighing the consequences of marijuana use and other controlled substances, marijuana poses a lower risk. Also, I am voting for adult-use cannabis legalization because I think it may serve as a stepping stone to decriminalize marijuana usage and possession.  This, hopefully, can allow men and women who are serving outlandish mandatory minimum sentences for minimal marijuana charges, to have their records expunged. ","1","0.42"
"I am voting for adult-use cannabis legalization because I feel it is unjust to criminalize something so small and natural. ","1","0.42"
"i am voting for adult-use cannabis legalization because it will diminish the marijuana arrest on black people and hopefully lower the bias crime against african americans  as well as make a drug most people use regularly finally legal. ","1","0.42"
"I am voting for Cannabis Legalization because I don’t believe it is right to put people in jail for using cannabis or dealing it. Firstly we have alcohol in this world, which is known to have actual effects of harming your health. Yet it is “socially acceptable”. So why are we allowed to drink alcohol which can eventually kill you, but can’t use cannabis? Legalizing cannabis would be good because we could actually get more research on how cannabis effects the body, etc. Cannabis use will still happen even if it’s illegal or not, so why not make it safer and legal to use cannabis? It’s a medical option for treating certain medical conditions. it only makes sense to legalize cannabis. Also cannabis is great and that is why I’m voting to legalize adult use of cannabis. ","1","0.42"
"I am voting for it based on the fact that of all substances, this has the least amount of negative effects on the populous, even when compared to alcohol it seems to be less.","1","0.42"
"i am voting for it because i feel like if alcohol is legal why can’t cannabis be! some people it’s helps with pain and anxiety and it being legal would much less stress for them .","1","0.42"
"I am voting in this legalization as I strongly am against this. I think legalizing marijuana will have negative impacts in many ways. ","1","0.42"
"I am voting to end prohibition of a substance that is safer than alcohol and has been demonized by the government for far too long.","1","0.42"
"I believe cannabis use should be legalized because it would benefit not only the state bringing in more money, but it will also help the racial disparity and the problems facing people of color being arrested far more likely than non poc.","1","0.42"
"I believe it should be a legal substance because it will bring in much needed revenue to the state and it will take the stigma off of cannabis use as well as stopping arrests for it’s use. ","1","0.42"
"I believe it will be a great revenue source and if restricted like alcohol would not have a negative impact on the state.","1","0.42"
"I believe it will greatly help the economy with taxing it... ","1","0.42"
"I believe it will help decrease crime rates associated with marijuana.","1","0.42"
"I believe it will help normalize the use of cannabis in both a recreational use and more importantly, medicinal use.","1","0.42"
"I believe it would free up the police and judicial system, as well as the prisons.","1","0.42"
"I believe that cannabis shouod be treated as alcohol and tobacco products - legal for of-age individuals.","1","0.42"
"I believe that it should be legal. If smoking and drinking are legal this should be as well. There are many health benefits as well. ","1","0.42"
"I believe the criminalization of Marijuana is ridiculous. And NJ could certainly use a boost in revenue.","1","0.42"
"I believe the representation is misunderstood because it a drug. However that’s a misconception. Adults use daily medicine everyday to survive for multiple reasons. Marijuana has many helping benefits to each person.","1","0.42"
"I do believe legalizing cannabis for recreational use will lead to more widespread deterioration of the family unit, much like alcohol and gambling.","1","0.42"
"I don't believe cannabis is any more or less harmful than alcohol or cigarettes.   I believe the revenue stimulated by the legalization of cannabis will have a huge benefit for the state and the taxpayers. ","1","0.42"
"I don't like the smell of marijuana and I think it would be a problem with people driving while under the influence going forward.","1","0.42"
"I don’t believe cannabis is as dangerous as previously thought and the prohibition of it has lead to a underground market and too much incarceration. I think legalization will generate tax revenue, cut down on drug dealing, and ease the burden/cost on our legal system.","1","0.42"
"I don’t use cannabis but believe so be equivalent to alcohol in terms of social harm.  Can’t justify the disparate treatment.","1","0.42"
"I feel if alcohol can be legal, so should cannabis ","1","0.42"
"I feel it gives some medical pain relief. It will help law enforcement & courts focus on larger drug crimes. Drugs that kill!","1","0.42"
"I feel it should be legal and will not only help the economy but will help eliminate arrests for this matter. ","1","0.42"
"I feel like this will provide more money for our town and for people struggling due to COVID 19, the money will provide funds that we are not capable of achieving without the legalization. I personally struggle with anxiety and sleep disorders myself. If cannabis was legal in New Jersey I would be able to cope with my anxiety. ","1","0.42"
"I feel that it should be more up to the person to decide and if they get it legally it will result in similar uses like alcohol. People would have to abide by laws and such so there also is regulations if people where to misuse it. I feel like this can help the safety of people and also keep people out of trouble. ","1","0.42"
"I have a severe allergy which sends me to the hospital if I even smell marijuana. If it was being legalized in only private settings, I would vote for it. If I walk by someone on the street doing it, I will go into anaphylactic shock. ","1","0.42"
"I have been a cannabis user for many years and I believe it should be legal","1","0.42"
"I have never partaken in cannabis use, but its benefits are undeniable. Health benefits are incredible, and the option to make it widely available, without thc or otherwise, is important to the population. If the tax benefits are utilized well by New Jersey, it could truly help our infrastructure, schools, and hopefully many other areas. I also hope that legalization will retroactively help those with offenses on their records and those who are currently incarcerated. ","1","0.42"
"I know a lot of professional, successful individuals who 55 plus years of age who smoked since they were in College and still do. Several now have a medical reason and are using to relieve pain. My husband has been fighting cancer for over 2 years. He had 2/3 of his tongue rebuilt. Glad he stoped RX narcotics and chose medical marijuana to relieve pain. It helped him during chemo and radiation too","1","0.42"
"I lived in WA state when cannabis was legalized. There was a process that took time, going slowly to make sure all i’s were dotted and t’s were crossed, to include safety and public safety. Tax payments  increased to many communities and rarely had increased in unsafe behavior. ","1","0.42"
"I personally believe that the stigma is a false narrative and there is much to gain by federally researching and charting the results for many.","1","0.42"
"I personally do not enjoy Marijuana  from my experiences with it, but I know that other people enjoy it and it helps them, so I think it would be good","1","0.42"
"I see it as less threatening than alcohol. Decriminalizing it and putting it to market could have positive financial opportunities for the state.","1","0.42"
"I see no reason for it not to be legal. There is also tax revenue streams.","1","0.42"
"I think it can help dissolve some racial disparities within our justice system ","1","0.42"
"I think it will have a positive affect on the economy and racial relations in the criminal justice system.","1","0.42"
"I think it will have a positive effect on the state! ","1","0.42"
"I think it will help others, either from illegal activities or medical.","1","0.42"
"I think it would benefit the economy of NJ by making it a taxable good. I also believe it would minimize some of the harsh sentences for racial minorities in the state.","1","0.42"
"I think its time that be legalized both for medical and recreational uses.","1","0.42"
"I think legalizing cannabis could increase tax revenue for the state and decrease the amount of legal issues surrounding small amounts of marijuana during misdemeanor encounters with law enforcement. ","1","0.42"
"I think that cannabis is a great alternative for people especially when it comes to medication for mental illness. Rather than taking a man-made drug, I would much rather take a more natural remedy which is why I would want it to be legalized. In addition, there are so many people charged with possession of weed and end up doing time longer than a person who SHOULD be in jail for committing a more heinous crime. Also because it is portrayed negatively and attached with a negative connotation. ","1","0.42"
"I think that people should be able to use it as long as they are over 21. I think there are a lot of people in prison right now for this that don’t need to be, so in the future it can lessen the strain on our prison systems.","1","0.42"
"I think there are way more benefits than people realize","1","0.42"
"I think there s a place for legalized cannabis. I think that it would be a positive economic decision and I also think that those who use it for medicinal purposes would have monitored access to it as opposed to getting it off the street.","1","0.42"
"I would be in favor of the legalization of marijuana in NJ on the simple basis that it is less harmful than alcohol.  ","1","0.42"
"I’m in favor of legalization because if NJ taxed it imagine the funds that we could collect ","1","0.42"
"I’m voting for adult-use cannabis legalization, because marijuana isn’t hurting anyone. ","1","0.42"
"I’m voting for because marijuana isn’t as bad as the government makes it out to be ","1","0.42"
"I’m voting for it for many reasons. Decriminalize society for over crowded jail cells. Use for mental illness. Use for many other illnesses. It will also boost NJ economically. ","1","0.42"
"I’m voting for it not only because I feel people shouldn’t be punished for using a drug that has been proven to help them but also because it’s unfair that treatment on this topic varies depending on where you are. Keeping it legal & people in jail for selling it is racist. ","1","0.42"
"I’m voting for the legalization of cannabis because first and for most there hasn’t been any reported deaths due to cannabis and also cannabis is a relaxer drug and in my opinion it will never be a gateway drug.","1","0.42"
"If I vote yes, it would be because I would like its medical benefits of it available for more people","1","0.42"
"If legally sold it would be better","1","0.42"
"Im voting for the adult use of cannabis because it will help the incarceration rate drop. Also almost everyone I met has smoked cannabis, so I believe that it should be treated like alcohol and not like a drug.","1","0.42"
"In moderation, this is fine.  I only worry about overuse.  I want it decriminalized. ","1","0.42"
"In my opinion, not different than alcohol. ","1","0.42"
"It's a harmless and beneficial plant","1","0.42"
"It's no worse than alcohol, and in many ways better. And it will be a boom to the state's economy. ","1","0.42"
"It's ridiculous that's it's been illegal for so long. It's fairly harmless. The powers that be have ruined lives over a plant. Now they can tax it. It.","1","0.42"
"It as much safer than heroin and alcohol and provides excellent physical and mental relief ","1","0.42"
"It doesn’t hurt anyone!","1","0.42"
"It has a lot of beneficial effects","1","0.42"
"It has been shown in other states where it has been legalized, to have huge revenue for the states. That money going to be used for school funding, veterans programs, helping the homeless. They have also not had an increase in crime due the legalization. ","1","0.42"
"It is a safer substance that alcohol. The reason it was made illegal was really not legitimate in the first place. It will be a tremendous source of revenue for the state. ","1","0.42"
"It is about time...we legalized alcohol so long ago","1","0.42"
"It is not a dangerous drug and legalization will make it safer for those who use it. If it is not legal it is not regulated and it could be laced with harmful drugs.","1","0.42"
"It is the right thing to do","1","0.42"
"It is the right thing to do.","1","0.42"
"it needs to be legalized for medicinal use already","1","0.42"
"It overcrowds the court system. Also, people use it everyday for anxiety. Ptsd. Pain. Etc and are functional productive members of society. No reason why it should be illegal. I’ve been to Denver where it is legal and they tax it and make money off of it as well. ","1","0.42"
"It should have never been illegal. Alcohol isn’t bad that very bad for you. Cannabis has many positive effects for many different ailments ","1","0.42"
"it should never have been a law.","1","0.42"
"It should never have been illegal. Be that as it may, legalize it and tax it for good NJ causes, like lowering our PTax. ","1","0.42"
"It should never have been made illegal in the first place. Possession is used to unfairly target minorities.  People will sell illegally anyway without paying taxes, this way the state gets fair share for social programs.","1","0.42"
"It will boost the economy. It is regulated for consumer safety, which is a really good thing because the people that are buying it off the street have no way of knowing   how safe those products really are. It helps decrease organized crime. It will help people of color because many people of color are disproportionately impacted and treated unfairly. They get harsher punishments. ","1","0.42"
"It will free up police to fight more serious crime ","1","0.42"
"It would make a huge impact on our states revenue and there is NO reason why it should not be legal. ","1","0.42"
"It’s a good money for the state","1","0.42"
"It’s about time","1","0.42"
"It’s on the same level as drinking for me. If drinking is legal, so should cannabis. ","1","0.42"
"It’s the smart thing to do. There are many positive reasons to legalize recreational use of cannabis.","1","0.42"
